{
  "schema_version": 1,
  "profile": "regulatory",
  "max_bytes": 80000,
  "paths": [
    "AGENTS.md",
    "docs/WORKSTREAM_SYNC.md",
    "conductor/tracks.md",
    "docs/evidence_interface.md",
    "docs/m2_retail_contract.md",
    "src/tobac/matched.py",
    "docs/research/M2_EVIDENCE_SYNTHESIS.md",
    "src/tobac/partial_identification.py",
    "evidence/m2/synthesis_20261027.json"
  ],
  "base_commit": null,
  "required_paths": [
    "AGENTS.md",
    "docs/WORKSTREAM_SYNC.md"
  ]
}
